{
  "schema_version": "1.0.0",
  "pack_id": "mingsi-mentor-m1",
  "version": "1.1",
  "lessons": [
    {
      "id": "L01",
      "version": "1.0",
      "editorial_order": 1,
      "title": "改动之前，先说清希望什么变好。",
      "theme": "iteration",
      "applicable_contexts": [
        "总觉得还要改一点，却说不清期待的效果"
      ],
      "claim": "一个改动可以顺利完成，却仍然不知道有没有改善使用。动手之前，先写一句“我预计这个改动会让谁的哪一步更容易”，能让改完之后有一个检查方向。",
      "example": "例如，你把常用操作从菜单移到首页，希望第一次使用的人更容易找到它。按钮是否移好了，是交付检查；对方能否更快找到入口，是效果检查。可以请一个不熟悉页面的人完成相同的小任务，观察他停在哪里。这个观察能提供线索，但一个人的表现还不足以证明所有用户都会受益。",
      "boundary": "这不是要求每次修改都做正式实验。修复明确错误、满足无障碍要求，已经有直接的判断依据。这个角度更适合“总觉得不够好，却说不清还要改什么”的时候。",
      "observation": "愿意的话，拿最近的一次改动，试着写出希望谁的哪一步变容易。",
      "source_type": "teaching_example",
      "citations": [],
      "content_hash": "sha256:e3b8ce0b1c6ae1680e7dcbf44a070f98d2bb3596b888f51e53430df719c32283",
      "review": {
        "status": "approved",
        "reviewed_by": "Codex (AI editor; user-authorized personal exploration)",
        "reviewed_at": "2026-10-11T13:03:05Z",
        "note": "用户于2026-10-11明确授权AI逐篇编辑审核并启用自用版；Codex及独立AI编辑实际阅读全文，L08/L14/L16修订后复核。教学示例，非人工审核，未证明用户获益。逐条结论见docs/content/2026-10-11-mentor-editorial-assessment.md。"
      }
    },
    {
      "id": "L02",
      "version": "1.0",
      "editorial_order": 2,
      "title": "给观察和解释各留一个位置。",
      "theme": "observation",
      "applicable_contexts": [
        "信息有限，却已经形成了一个强烈解释"
      ],
      "claim": "我们描述一件事时，经常把看到的情况和对它的解释放在同一句话里。把两者分别说出来，可以保留更多理解事情的空间。",
      "example": "例如，“对方没有回复，所以他不重视这个需求”包含了两个层次：目前没有收到回复，是你能确认的情况；不重视，是一种解释。还有哪些情况可能产生同样的现象，需要结合约定的时间、对方是否收到，以及事情是否需要回复来判断。先分开，不代表原来的解释一定错误，也不要求永远替别人寻找理由。",
      "boundary": "这个方法适合信息有限却已经形成强烈结论的时候。如果你已经有多次直接证据，就可以据此作出判断。",
      "observation": "愿意的话，想起最近一句带着“所以”的描述，看看前半句提供了什么观察，后半句加入了什么解释。",
      "source_type": "teaching_example",
      "citations": [],
      "content_hash": "sha256:3487c9440e310c1cd9b09ea02697a80f4bbbbae150f3f6603fcde5eba5c439ed",
      "review": {
        "status": "approved",
        "reviewed_by": "Codex (AI editor; user-authorized personal exploration)",
        "reviewed_at": "2026-10-11T13:03:05Z",
        "note": "用户于2026-10-11明确授权AI逐篇编辑审核并启用自用版；Codex及独立AI编辑实际阅读全文，L08/L14/L16修订后复核。教学示例，非人工审核，未证明用户获益。逐条结论见docs/content/2026-10-11-mentor-editorial-assessment.md。"
      }
    },
    {
      "id": "L03",
      "version": "1.0",
      "editorial_order": 3,
      "title": "一次变慢，先看看它和什么相比。",
      "theme": "observation",
      "applicable_contexts": [
        "看到一次变化，想判断是否需要处理"
      ],
      "claim": "判断变化是否异常，需要一个可比较的背景。单独看到“今天慢了”还不够，可以先看同类情况通常怎样，以及这次有没有不同条件。",
      "example": "例如，平时十分钟能走到车站，今天用了十五分钟。多出的五分钟可能来自路口施工，也可能只是刚好遇到几次红灯。把今天和同一时段、同一路线的经历相比，比拿它和周日清晨相比更有意义。如果连续几天都被同一处施工挡住，提前出门或换路线就有了更具体的依据。这里有用的是找到可比较条件，而不是给每一分钟都建立记录。",
      "boundary": "有明显危险信号时，应先处理安全问题，不能为了凑足样本而等待。比较背景更适合低风险、原因尚不清楚的日常波动。",
      "observation": "愿意的话，给最近的一次“比以前差了”补上一个明确的比较对象。",
      "source_type": "teaching_example",
      "citations": [],
      "content_hash": "sha256:ce6f32db67e9e47a5d6043e21fb25de174833b261a2ae520f3edf485d558580a",
      "review": {
        "status": "approved",
        "reviewed_by": "Codex (AI editor; user-authorized personal exploration)",
        "reviewed_at": "2026-10-11T13:03:05Z",
        "note": "用户于2026-10-11明确授权AI逐篇编辑审核并启用自用版；Codex及独立AI编辑实际阅读全文，L08/L14/L16修订后复核。教学示例，非人工审核，未证明用户获益。逐条结论见docs/content/2026-10-11-mentor-editorial-assessment.md。"
      }
    },
    {
      "id": "L04",
      "version": "1.0",
      "editorial_order": 4,
      "title": "借一个第一次使用的视角。",
      "theme": "observation",
      "applicable_contexts": [
        "熟悉某个流程，却不理解别人为什么会卡住"
      ],
      "claim": "熟悉一件事后，我们容易把自己知道的背景当成人人都知道。观察第一次接触的人怎样寻找下一步，有时能看见自己已经不再注意的提示缺口。",
      "example": "例如，你给朋友写了一份到家路线，觉得“到楼下打电话”已经足够。朋友却停在了小区外，因为入口有两个，你没有写从哪一个进。站在门口陪对方走一次，可能比反复解释“很容易找”更有帮助。看产品也一样：先让对方尝试一个具体任务，留意停顿和寻找的地方，再询问当时在找什么，不急着接过操作。",
      "boundary": "一个初次使用者的困难不代表所有人的困难。专业工具也可以合理要求一定基础；需要核对的是预期用户应具备的知识和实际提供的提示。",
      "observation": "愿意的话，找出最近一次说明里，被你省略的一条背景信息。",
      "source_type": "teaching_example",
      "citations": [],
      "content_hash": "sha256:14cf81220daeb302b5cba250061835226ce721dbe0975ecdf7ddbde1947c0ab6",
      "review": {
        "status": "approved",
        "reviewed_by": "Codex (AI editor; user-authorized personal exploration)",
        "reviewed_at": "2026-10-11T13:03:05Z",
        "note": "用户于2026-10-11明确授权AI逐篇编辑审核并启用自用版；Codex及独立AI编辑实际阅读全文，L08/L14/L16修订后复核。教学示例，非人工审核，未证明用户获益。逐条结论见docs/content/2026-10-11-mentor-editorial-assessment.md。"
      }
    },
    {
      "id": "L05",
      "version": "1.0",
      "editorial_order": 5,
      "title": "顺利完成，也有东西值得看。",
      "theme": "observation",
      "applicable_contexts": [
        "一天没有明显问题，不知道能回看什么"
      ],
      "claim": "回看不必从失败开始。一次事情顺利完成，可能包含可以再次利用的安排；把它指出来，比笼统地说“今天状态不错”更容易保留经验。",
      "example": "例如，你和同事很快定下了一个方案。回想过程，你发现会前发出的两张对比图让大家知道差别在哪里，讨论没有从解释术语开始。可以暂时记下“这次提前展示差异似乎有帮助”。下次类似讨论再观察它是否仍然有效，也看看参与者熟悉程度和问题复杂度有没有变化。你不必把整场会议重新写一遍，只抓住一处可描述的安排就够了。",
      "boundary": "顺利可能也与运气、他人准备或任务较简单有关。找到一个可能有用的条件，不等于证明成功全由自己造成，更不要求每天提炼一条经验。",
      "observation": "愿意的话，留意今天哪一步比预想省力，以及当时有什么具体条件。",
      "source_type": "teaching_example",
      "citations": [],
      "content_hash": "sha256:66d16b9ad7514f41574f7a41f3f671f6ac524447c5527f20e7a9ef1796321434",
      "review": {
        "status": "approved",
        "reviewed_by": "Codex (AI editor; user-authorized personal exploration)",
        "reviewed_at": "2026-10-11T13:03:05Z",
        "note": "用户于2026-10-11明确授权AI逐篇编辑审核并启用自用版；Codex及独立AI编辑实际阅读全文，L08/L14/L16修订后复核。教学示例，非人工审核，未证明用户获益。逐条结论见docs/content/2026-10-11-mentor-editorial-assessment.md。"
      }
    },
    {
      "id": "L06",
      "version": "1.0",
      "editorial_order": 6,
      "title": "给判断补上依据的来处。",
      "theme": "evidence",
      "applicable_contexts": [
        "有一个结论，但不确定依据是否足够"
      ],
      "claim": "判断的力度应与依据相称。“我亲自看到了”“有人告诉我”和“我据此推测”提供的支持不同。标出来，可以更清楚地知道还需要核对什么。",
      "example": "例如，你听说用户不喜欢一个新入口。这个说法可能来自三次访谈里的直接抱怨，也可能只是同事转述了一次找不到按钮的经历。前者值得查看具体语境，后者可以作为进一步观察的线索。先问清是哪个用户、在哪一步、发生了什么，比立刻争论“要不要把入口改回去”更容易让讨论向前。依据可以暂时很少，只要没有把线索说成已经确认的普遍结论。",
      "boundary": "不必给每句日常表达附上文献。需要更认真核对的，是影响较大、难以撤回或争议明显的决定；可靠的经验也有价值，但要说明适用背景。",
      "observation": "愿意的话，把一个近期判断接成“我这样想，主要因为……”。",
      "source_type": "teaching_example",
      "citations": [],
      "content_hash": "sha256:5d90ccf4effbb54ff79d34d9a9158fa153d8931f2cf6d95e6ebde16a0f0fba38",
      "review": {
        "status": "approved",
        "reviewed_by": "Codex (AI editor; user-authorized personal exploration)",
        "reviewed_at": "2026-10-11T13:03:05Z",
        "note": "用户于2026-10-11明确授权AI逐篇编辑审核并启用自用版；Codex及独立AI编辑实际阅读全文，L08/L14/L16修订后复核。教学示例，非人工审核，未证明用户获益。逐条结论见docs/content/2026-10-11-mentor-editorial-assessment.md。"
      }
    },
    {
      "id": "L07",
      "version": "1.0",
      "editorial_order": 7,
      "title": "先说什么会让你改主意。",
      "theme": "evidence",
      "applicable_contexts": [
        "讨论反复争执，却不知道下一步查什么"
      ],
      "claim": "如果一个判断无论出现什么情况都不会改变，就很难通过新信息校准它。提前说明什么迹象会让自己重新考虑，能让讨论转向可检查的条件。",
      "example": "例如，你认为用户主要因为操作步骤多而放弃填写。可以先说：如果他们很快完成每一步，却在看到收费说明时离开，我会重新考虑原因。这样，下一次观察就有了区分解释的方向。另一种可能是用户根本没有当前需求；缩短步骤也未必让他继续。找到区分条件，并不需要先为每种原因写一套完整方案，更不用为了证明自己正确而只观察支持它的情况。",
      "boundary": "有些价值选择无法由一条数据决定，例如是否愿意承担某种风险。此时可以明确价值前提，并分别检验支撑选择的事实判断。",
      "observation": "愿意的话，为一个尚未确定的判断留下一条“如果出现这个情况，我会再想想”。",
      "source_type": "teaching_example",
      "citations": [],
      "content_hash": "sha256:88ff9580d1eead37ab3a6b9cbe56082992ddcbcad3e496cf7339480f6da6eaf6",
      "review": {
        "status": "approved",
        "reviewed_by": "Codex (AI editor; user-authorized personal exploration)",
        "reviewed_at": "2026-10-11T13:03:05Z",
        "note": "用户于2026-10-11明确授权AI逐篇编辑审核并启用自用版；Codex及独立AI编辑实际阅读全文，L08/L14/L16修订后复核。教学示例，非人工审核，未证明用户获益。逐条结论见docs/content/2026-10-11-mentor-editorial-assessment.md。"
      }
    },
    {
      "id": "L08",
      "version": "1.1",
      "editorial_order": 8,
      "title": "一次结果，先支持一个有限结论。",
      "theme": "evidence",
      "applicable_contexts": [
        "一次成功或失败之后，想总结普遍经验"
      ],
      "claim": "一次结果能告诉我们这一次发生了什么，也能提供值得继续观察的线索。它对其他人的适用性，需要结合条件变化和更多证据来判断。",
      "example": "例如，你把一段说明缩短后，一位朋友更快完成了操作。可以确认的是：他在这次任务中完成得更快。是否因为说明更容易理解，还需要核对他是否已经熟悉流程、任务是否更简单，以及有没有漏看重要限制。保留这些条件，下次找不同背景的人尝试时就知道该看什么。即使暂时没有更多样本，也可以记录这个有限结果，而不必在“完全证明”和“毫无价值”之间二选一。",
      "boundary": "明确可复现的程序错误可以被一次失败直接暴露；高风险后果也值得立即重视。这里限制的是把一次结果推广到所有情境的幅度。",
      "observation": "愿意的话，在一次经验后补上“至少在这次的这些条件下”。",
      "source_type": "teaching_example",
      "citations": [],
      "content_hash": "sha256:d1f963a2917f9b8008d40e4e2d26d539792cc315898beafaff7c6484112f36de",
      "review": {
        "status": "approved",
        "reviewed_by": "Codex (AI editor; user-authorized personal exploration)",
        "reviewed_at": "2026-10-11T13:03:05Z",
        "note": "用户于2026-10-11明确授权AI逐篇编辑审核并启用自用版；Codex及独立AI编辑实际阅读全文，L08/L14/L16修订后复核。教学示例，非人工审核，未证明用户获益。逐条结论见docs/content/2026-10-11-mentor-editorial-assessment.md。"
      }
    },
    {
      "id": "L09",
      "version": "1.0",
      "editorial_order": 9,
      "title": "不知道，也可以留下一个清楚的下一步。",
      "theme": "evidence",
      "applicable_contexts": [
        "信息不足，担心自己必须马上得出结论"
      ],
      "claim": "暂时不知道不是空白结果。把已知事实、关键未知和获取信息的办法分开，可以帮助你决定先做什么，或者有依据地等待。",
      "example": "例如，线上偶尔出现保存失败，你只知道两位用户报告过，却还不知道发生在哪个版本。现在就重写保存模块，可能花很多时间仍找不到原因。先保留失败时间、版本和具体操作，再检查是否有一致条件，会让后续调查更有方向。你可以明确写下“尚不能确认原因，先补版本与错误记录”。这句话没有给出最终解释，却让下一步比泛泛地继续排查更具体。",
      "boundary": "不能为了获得完美信息而无限拖延。若等待本身有较大损失，可以先采取可撤回的保护措施，并说明它是在信息有限时作出的临时决定。",
      "observation": "愿意的话，给一个卡住的问题写下最影响下一步的那项未知。",
      "source_type": "teaching_example",
      "citations": [],
      "content_hash": "sha256:64eeb60e29d899cc8f281d743f7579448a4e3a2291750849740e9fc33e39c3c6",
      "review": {
        "status": "approved",
        "reviewed_by": "Codex (AI editor; user-authorized personal exploration)",
        "reviewed_at": "2026-10-11T13:03:05Z",